{
  "author": "human:alice",
  "branch": "main",
  "changes": [
    {
      "op": "init"
    },
    {
      "file": "sample.ipynb",
      "op": "import",
      "source": "ipynb"
    }
  ],
  "commit_id": "commit_001",
  "created_at": "2026-01-01T02:00:00Z",
  "message": "Import sample.ipynb from ipynb (provenance incomplete)",
  "parents": []
}